title,category,probability,impact,risk_score,status,owner,mitigation,due_date,blockers
Critical CVE-6387 regreSSHion not patched on all nodes,security,high,Unauthenticated RCE on all OpenSSH servers,95,open,Elena Rodriguez,Emergency patch window scheduled. Interim: restrict SSH to VPN only.,2026-05-20,"{""Change freeze window"",""Requires maintenance mode""}"
GDPR Art.17 Right to Erasure broken - regulatory fine risk,compliance,high,Regulatory fine up to 4% global revenue (~$12M),92,in_progress,Aisha Williams,Engineering sprint dedicated. Legal notified. DPA engagement pending.,2026-05-31,"{""Cross-team dependency on 4 legacy systems""}"
DDoS attack ongoing - WAF capacity at 94%,operational,high,Full service outage if mitigation fails,88,open,Sarah Chen,AWS Shield Advanced engaged. Traffic scrubbing active. Backup routes configured.,2026-05-15,{}
Payment service single point of failure,operational,medium,Revenue loss $50K per minute during outage,76,open,David Kim,Multi-region deployment planned for Q3. Interim: enhanced monitoring.,2026-08-01,"{""Budget approval pending"",""PCI-DSS scope expansion required""}"
SOC2 CC6.1 MFA gap - audit finding,compliance,high,SOC2 Type II certification at risk,82,in_progress,Aisha Williams,Okta MFA rollout 68% complete. Target 100% by May 31.,2026-05-31,"{""Legacy app incompatibility""}"
k8s-node-worker-02 disk pressure escalation risk,operational,medium,Pod evictions causing service degradation,65,open,Marcus Johnson,Log rotation fixed. Node drain scheduled for disk expansion.,2026-05-17,{}
Supply chain attack vector - no SBOM tracking,security,medium,Undetected malicious dependencies like XZ attack,71,open,Elena Rodriguez,SBOM generation tool evaluation in progress. Syft + Grype POC running.,2026-06-30,"{""Tool selection not finalized""}"
Vendor BAA renewals overdue - HIPAA risk,compliance,medium,HIPAA violation if PHI shared with non-BAA vendors,68,in_progress,Priya Patel,Legal review initiated on 3 vendors. Escalated to CISO.,2026-05-25,"{""Legal team bandwidth""}"
